Testing bot: WordleBot
___ Testing word: 洧똀洧洧쮫롖쩛롗 ___

First Starting word: 'TARES' (Best starting word for catching common words)
Guess: 洧똂洧떂洧똀洧洧똁, Feedback: 拘럻릳游릳游릳拘
entropy_info: None
----------
The bot originally chose: BEARD 
The top ten guesses and scores: [('BEARD', 610), ('BREAD', 610), ('DEBAR', 610), ('CEDAR', 606), ('ECARD', 606), ('DEARN', 603), ('DENAR', 603), ('DREAM', 603), ('GRADE', 603), ('REDAN', 603)]
The bot finally chose: BEARD 
Guess: 洧떃洧洧떂洧똀洧, Feedback: 拘럻릴游릳游릳拘
entropy_info: None
----------
The bot originally chose: RENAL 
The top ten guesses and scores: [('RENAL', 90), ('REGAL', 89), ('REGNA', 88), ('RENGA', 88), ('REPLA', 88), ('RELAY', 86), ('RECAL', 85), ('REFAN', 85), ('RELAX', 85), ('REMAN', 85)]
The bot finally chose: RENAL 
Guess: 洧똀洧洧뗼洧떂洧뗺, Feedback: 游릴游릴拘럻릴拘
entropy_info: None
----------
The bot originally chose: RECAP 
The top ten guesses and scores: [('RECAP', 24), ('REMAP', 24), ('REPAY', 24), ('REWAX', 22), ('REEAF', 21), ('REGAR', 21)]
The bot finally chose: RECAP 
You won! Amount of guesses: 4

===================================
History:
Guess: 洧똂洧떂洧똀洧洧똁, Feedback: 拘럻릳游릳游릳拘
Guess: 洧떃洧洧떂洧똀洧, Feedback: 拘럻릴游릳游릳拘
Guess: 洧똀洧洧뗼洧떂洧뗺, Feedback: 游릴游릴拘럻릴拘
Guess: 洧똀洧洧쮫롖쩛롗, Feedback: 游릴游릴游릴游릴游릴
===================================

Testing bot class: WordleBot complete.

----------------------------------------------------------------------------------------------------
Testing bot: EntropyWordleBot
___ Testing word: 洧똀洧洧쮫롖쩛롗 ___


The bot is making a guess...
First Starting word: TARES (Best starting word for catching common words)

Guess: 洧똂洧떂洧똀洧洧똁, Feedback: 拘럻릳游릳游릳拘
Actual Info Gain: 6.4578 bits
Posterior entropy: 7.400879436282184
entropy_info: {'prior_entropy': 13.858660984722777, 'posterior_entropy': 7.400879436282184, 'actual_info_gain': 6.457781548440592, 'expected_info_gain': 6.15937645579268}
----------

The bot is making a guess...
Initial guess by the bot: BEARD with entropy: 4.1781
Bot chose: BEARD with entropy: 4.1781
Top ten guesses: [('BEARD', 4.178126483345813), ('DEARE', 4.1319976865497905), ('DEARN', 4.081354500010559), ('REARD', 4.0631278659179095), ('BEARE', 4.026830648679552), ('BREAD', 3.9355579291943235), ('FEARD', 3.934082646102317), ('DEARY', 3.925629033949298), ('LEARE', 3.902155033200686), ('CRARE', 3.8865826751505033)]

Guess: 洧떃洧洧떂洧똀洧, Feedback: 拘럻릴游릳游릳拘
Actual Info Gain: 2.8159 bits
Posterior entropy: 4.584962500721156
entropy_info: {'prior_entropy': 7.400879436282184, 'posterior_entropy': 4.584962500721156, 'actual_info_gain': 2.8159169355610283, 'expected_info_gain': 4.178126483345813}
----------

The bot is making a guess...
Initial guess by the bot: RENAL with entropy: 3.3239
Bot chose: RENAL with entropy: 3.3239
Top ten guesses: [('RENAL', 3.3239348962840563), ('RELAY', 2.886842188131012), ('REGAL', 2.8647869792568117), ('RENGA', 2.8035088547976783), ('REPLA', 2.7824156286861546), ('RELAX', 2.7814536459234778), ('RENAY', 2.772055208874201), ('REFAN', 2.75), ('RECAL', 2.7295739585136225), ('REMAN', 2.7295739585136225)]

Guess: 洧똀洧洧뗼洧떂洧뗺, Feedback: 游릴游릴拘럻릴拘
Actual Info Gain: 2.0000 bits
Posterior entropy: 2.584962500721156
entropy_info: {'prior_entropy': 4.584962500721156, 'posterior_entropy': 2.584962500721156, 'actual_info_gain': 2.0, 'expected_info_gain': 3.3239348962840563}
----------

The bot is making a guess...
Initial guess by the bot: RECAP with entropy: 1.7925
Bot chose: RECAP with entropy: 1.7925
Top ten guesses: [('RECAP', 1.7924812503605778), ('REMAP', 1.7924812503605778), ('REPAY', 1.4591479170272448), ('REEAF', 0.6500224216483541), ('REGAR', 0.6500224216483541), ('REWAX', 0.6500224216483541)]
You won! Amount of guesses: 4

===================================
History:
Guess: 洧똂洧떂洧똀洧洧똁, Feedback: 拘럻릳游릳游릳拘, Prior Entropy: 13.859, Expected Info Gain: 6.159 bits, Actual Info Gain: 6.458 bits, Posterior Entropy: 7.401, 
Guess: 洧떃洧洧떂洧똀洧, Feedback: 拘럻릴游릳游릳拘, Prior Entropy: 7.401, Expected Info Gain: 4.178 bits, Actual Info Gain: 2.816 bits, Posterior Entropy: 4.585, 
Guess: 洧똀洧洧뗼洧떂洧뗺, Feedback: 游릴游릴拘럻릴拘, Prior Entropy: 4.585, Expected Info Gain: 3.324 bits, Actual Info Gain: 2.000 bits, Posterior Entropy: 2.585, 
Guess: 洧똀洧洧쮫롖쩛롗, Feedback: 游릴游릴游릴游릴游릴
===================================

Testing bot class: EntropyWordleBot complete.

----------------------------------------------------------------------------------------------------
Testing bot: FastEntropyWordleBot
___ Testing word: 洧똀洧洧쮫롖쩛롗 ___


The bot is making a guess...
First Starting word: TARES (Best starting word for catching common words)

Guess: 洧똂洧떂洧똀洧洧똁, Feedback: 拘럻릳游릳游릳拘
Actual Info Gain: 6.4578 bits
Posterior entropy: 7.400879436282184
entropy_info: {'prior_entropy': 13.858660984722777, 'posterior_entropy': 7.400879436282184, 'actual_info_gain': 6.457781548440592, 'expected_info_gain': 6.15937645579268}
----------

The bot is making a guess...
Initial guess by the bot: BEARD with entropy: 4.1781
Bot chose: BEARD with entropy: 4.1781
Top ten guesses: [('BEARD', 4.178126483345813), ('DEARE', 4.1319976865497905), ('DEARN', 4.081354500010559), ('REARD', 4.0631278659179095), ('BEARE', 4.026830648679552), ('BREAD', 3.9355579291943235), ('FEARD', 3.934082646102317), ('DEARY', 3.925629033949298), ('LEARE', 3.902155033200686), ('CRARE', 3.8865826751505033)]

Guess: 洧떃洧洧떂洧똀洧, Feedback: 拘럻릴游릳游릳拘
Actual Info Gain: 2.8159 bits
Posterior entropy: 4.584962500721156
entropy_info: {'prior_entropy': 7.400879436282184, 'posterior_entropy': 4.584962500721156, 'actual_info_gain': 2.8159169355610283, 'expected_info_gain': 4.178126483345813}
----------

The bot is making a guess...
Initial guess by the bot: RENAL with entropy: 3.3239
Bot chose: RENAL with entropy: 3.3239
Top ten guesses: [('RENAL', 3.3239348962840563), ('RELAY', 2.886842188131012), ('REGAL', 2.8647869792568117), ('RENGA', 2.8035088547976783), ('REPLA', 2.7824156286861546), ('RELAX', 2.7814536459234778), ('RENAY', 2.772055208874201), ('REFAN', 2.75), ('RECAL', 2.7295739585136225), ('REMAN', 2.7295739585136225)]

Guess: 洧똀洧洧뗼洧떂洧뗺, Feedback: 游릴游릴拘럻릴拘
Actual Info Gain: 2.0000 bits
Posterior entropy: 2.584962500721156
entropy_info: {'prior_entropy': 4.584962500721156, 'posterior_entropy': 2.584962500721156, 'actual_info_gain': 2.0, 'expected_info_gain': 3.3239348962840563}
----------

The bot is making a guess...
Initial guess by the bot: RECAP with entropy: 1.7925
Bot chose: RECAP with entropy: 1.7925
Top ten guesses: [('RECAP', 1.7924812503605778), ('REMAP', 1.7924812503605778), ('REPAY', 1.4591479170272448), ('REEAF', 0.6500224216483541), ('REGAR', 0.6500224216483541), ('REWAX', 0.6500224216483541)]
You won! Amount of guesses: 4

===================================
History:
Guess: 洧똂洧떂洧똀洧洧똁, Feedback: 拘럻릳游릳游릳拘, Prior Entropy: 13.859, Expected Info Gain: 6.159 bits, Actual Info Gain: 6.458 bits, Posterior Entropy: 7.401, 
Guess: 洧떃洧洧떂洧똀洧, Feedback: 拘럻릴游릳游릳拘, Prior Entropy: 7.401, Expected Info Gain: 4.178 bits, Actual Info Gain: 2.816 bits, Posterior Entropy: 4.585, 
Guess: 洧똀洧洧뗼洧떂洧뗺, Feedback: 游릴游릴拘럻릴拘, Prior Entropy: 4.585, Expected Info Gain: 3.324 bits, Actual Info Gain: 2.000 bits, Posterior Entropy: 2.585, 
Guess: 洧똀洧洧쮫롖쩛롗, Feedback: 游릴游릴游릴游릴游릴
===================================

Testing bot class: FastEntropyWordleBot complete.

----------------------------------------------------------------------------------------------------
Testing bot: CachedEntropyWordleBot
___ Testing word: 洧똀洧洧쮫롖쩛롗 ___

Loading letter frequencies...
Loaded letter frequency cache with 26 letters
The bot is making a guess...
First Starting word: TARES (Best starting word for catching common words)

Guess: 洧똂洧떂洧똀洧洧똁, Feedback: 拘럻릳游릳游릳拘
Actual Info Gain: 6.4578 bits
Posterior entropy: 7.400879436282184
entropy_info: {'prior_entropy': 13.858660984722777, 'posterior_entropy': 7.400879436282184, 'actual_info_gain': 6.457781548440592, 'expected_info_gain': 6.15937645579268}
----------
The bot is making a guess...
Updating candidate pool: Adding 100 common words...
Evaluating 266 potential guesses from 169 remaining candidates...
Top 5 guesses: [('BEARD', '4.178'), ('DEARE', '4.132'), ('DEARN', '4.081'), ('REARD', '4.063'), ('BEARE', '4.027')]
Top entropy choice: 洧떃洧洧떂洧똀洧 with entropy: 4.1781
Ended up choosing COMMON word: 洧떃洧洧떂洧똀洧 with entropy: 4.1781

Guess: 洧떃洧洧떂洧똀洧, Feedback: 拘럻릴游릳游릳拘
Actual Info Gain: 2.8159 bits
Posterior entropy: 4.584962500721156
entropy_info: {'prior_entropy': 7.400879436282184, 'posterior_entropy': 4.584962500721156, 'actual_info_gain': 2.8159169355610283, 'expected_info_gain': 4.178126483345813}
----------
The bot is making a guess...
Evaluating 24 potential guesses from 24 remaining candidates...
Top 5 guesses: [('RENAL', '3.324'), ('RELAY', '2.887'), ('REGAL', '2.865'), ('RENGA', '2.804'), ('REPLA', '2.782')]
Top entropy choice: 洧똀洧洧뗼洧떂洧뗺 with entropy: 3.3239
Ended up choosing COMMON word: 洧똀洧洧뗼洧떂洧뗺 with entropy: 3.3239

Guess: 洧똀洧洧뗼洧떂洧뗺, Feedback: 游릴游릴拘럻릴拘
Actual Info Gain: 2.0000 bits
Posterior entropy: 2.584962500721156
entropy_info: {'prior_entropy': 4.584962500721156, 'posterior_entropy': 2.584962500721156, 'actual_info_gain': 2.0, 'expected_info_gain': 3.3239348962840563}
----------
The bot is making a guess...
Evaluating 6 potential guesses from 6 remaining candidates...
Top 5 guesses: [('RECAP', '1.792'), ('REMAP', '1.792'), ('REPAY', '1.459'), ('REEAF', '0.650'), ('REGAR', '0.650')]
Top entropy choice: 洧똀洧洧쮫롖쩛롗 with entropy: 1.7925
Ended up choosing COMMON word: 洧똀洧洧쮫롖쩛롗 with entropy: 1.7925
You won! Amount of guesses: 4

===================================
History:
Guess: 洧똂洧떂洧똀洧洧똁, Feedback: 拘럻릳游릳游릳拘, Prior Entropy: 13.859, Expected Info Gain: 6.159 bits, Actual Info Gain: 6.458 bits, Posterior Entropy: 7.401, 
Guess: 洧떃洧洧떂洧똀洧, Feedback: 拘럻릴游릳游릳拘, Prior Entropy: 7.401, Expected Info Gain: 4.178 bits, Actual Info Gain: 2.816 bits, Posterior Entropy: 4.585, 
Guess: 洧똀洧洧뗼洧떂洧뗺, Feedback: 游릴游릴拘럻릴拘, Prior Entropy: 4.585, Expected Info Gain: 3.324 bits, Actual Info Gain: 2.000 bits, Posterior Entropy: 2.585, 
Guess: 洧똀洧洧쮫롖쩛롗, Feedback: 游릴游릴游릴游릴游릴
===================================

Testing bot class: CachedEntropyWordleBot complete.

----------------------------------------------------------------------------------------------------
Testing bot: NonGreedyCachedEntropyWordleBot
___ Testing word: 洧똀洧洧쮫롖쩛롗 ___

Loading letter frequencies...
Loaded letter frequency cache with 26 letters
The bot is making a guess...
First Starting word: TARES (Best starting word for catching common words)

Guess: 洧똂洧떂洧똀洧洧똁, Feedback: 拘럻릳游릳游릳拘
Actual Info Gain: 6.4578 bits
Posterior entropy: 7.400879436282184
entropy_info: {'prior_entropy': 13.858660984722777, 'posterior_entropy': 7.400879436282184, 'actual_info_gain': 6.457781548440592, 'expected_info_gain': 6.15937645579268}
----------
The bot is making a guess...
THe possible candidates are: ['ABEAR', 'ABORE', 'ACERB', 'ADORE', 'AFEAR', 'AFIRE', 'AFORE', 'AIERY', 'ALURE', 'AMORE', 'ANEAR', 'APERY', 'ARAME', 'AREAD', 'AREAE', 'AREAL', 'AREAR', 'ARECA', 'AREDD', 'AREDE', 'AREFY', 'AREIC', 'ARENA', 'ARENE', 'AREPA', 'ARERE', 'ARGLE', 'ARGUE', 'ARUHE', 'AWARE', 'AYGRE', 'AZURE', 'BEARD', 'BEARE', 'BEGAR', 'BEIRA', 'BELAR', 'BLARE', 'BLEAR', 'BRACE', 'BRAKE', 'BRAME', 'BRANE', 'BRAVE', 'BRAZE', 'BREAD', 'BREAK', 'BREAM', 'CEDAR', 'CHARE', 'CLEAR', 'CRAKE', 'CRAME', 'CRANE', 'CRAPE', 'CRARE', 'CRAVE', 'CRAZE', 'CREAK', 'CREAM', 'CREMA', 'CRENA', 'DEAIR', 'DEARE', 'DEARN', 'DEARY', 'DEBAR', 'DENAR', 'DEWAR', 'DRAKE', 'DRAPE', 'DRAVE', 'DREAD', 'DREAM', 'DREAR', 'ECARD', 'EGGAR', 'EMBAR', 'ENARM', 'ERBIA', 'ERICA', 'FEARD', 'FEARE', 'FEUAR', 'FLARE', 'FRAME', 'FRAPE', 'FREAK', 'FRENA', 'GEARE', 'GLARE', 'GRACE', 'GRADE', 'GRAME', 'GRAPE', 'GRAVE', 'GRAZE', 'HEARD', 'HEARE', 'HEJRA', 'HEPAR', 'IRADE', 'JEERA', 'KEBAR', 'LEARE', 'LEARN', 'LEARY', 'LEEAR', 'LEPRA', 'MEARE', 'OPERA', 'OREAD', 'OWARE', 'PEARE', 'PEARL', 'PHARE', 'PREAK', 'QUARE', 'REACH', 'READD', 'READY', 'REALM', 'REALO', 'REAME', 'REAMY', 'REARD', 'REARM', 'REAVE', 'REBAB', 'REBAR', 'RECAL', 'RECAP', 'REDAN', 'REDIA', 'REEAF', 'REFAN', 'REGAL', 'REGAR', 'REGIA', 'REGMA', 'REGNA', 'REHAB', 'RELAX', 'RELAY', 'REMAN', 'REMAP', 'RENAL', 'RENAY', 'RENGA', 'REPAY', 'REPLA', 'REWAN', 'REWAX', 'RIMAE', 'ROAKE', 'RUEDA', 'RUGAE', 'URARE', 'UREAL', 'URENA', 'VELAR', 'WEARY', 'WHARE', 'WHEAR', 'WREAK', 'YEARD', 'YEARN', 'ZEBRA', 'ZEERA']
169 candidate words remaining.
Top 10 guesses: [('BEARD', '4.178'), ('DRERE', '4.157'), ('DEARE', '4.132'), ('REERD', '4.123'), ('DEARN', '4.081'), ('REARD', '4.063'), ('BRERE', '4.036'), ('DRAMA', '4.027'), ('BEARE', '4.027'), ('BREDE', '4.025')]
Top entropy choice: 洧떃洧洧떂洧똀洧 with entropy: 4.1781
Guess count low, choosing the word with highest entropy: 洧떃洧洧떂洧똀洧 with entropy: 4.1781

Guess: 洧떃洧洧떂洧똀洧, Feedback: 拘럻릴游릳游릳拘
Actual Info Gain: 2.8159 bits
Posterior entropy: 4.584962500721156
entropy_info: {'prior_entropy': 7.400879436282184, 'posterior_entropy': 4.584962500721156, 'actual_info_gain': 2.8159169355610283, 'expected_info_gain': 4.178126483345813}
----------
The bot is making a guess...
THe possible candidates are: ['FEUAR', 'HEPAR', 'LEEAR', 'RECAL', 'RECAP', 'REEAF', 'REFAN', 'REGAL', 'REGAR', 'REGIA', 'REGMA', 'REGNA', 'RELAX', 'RELAY', 'REMAN', 'REMAP', 'RENAL', 'RENAY', 'RENGA', 'REPAY', 'REPLA', 'REWAN', 'REWAX', 'VELAR']
24 candidate words remaining.
Top 10 guesses: [('FINAL', '3.439'), ('LUNAR', '3.403'), ('XYLAN', '3.376'), ('FANAL', '3.355'), ('MYLAR', '3.340'), ('LINGY', '3.324'), ('LYING', '3.324'), ('RENAL', '3.324'), ('UNLAP', '3.324'), ('ULNAR', '3.320')]
Top entropy choice: 洧뗴洧뗷洧뗼洧떂洧뗺 with entropy: 3.4387
Using common exploratory word: 洧뗴洧뗷洧뗼洧떂洧뗺 with entropy: 3.4387

Guess: 洧뗴洧뗷洧뗼洧떂洧뗺, Feedback: 拘럭샢拘럻릴拘
Actual Info Gain: 2.0000 bits
Posterior entropy: 2.584962500721156
entropy_info: {'prior_entropy': 4.584962500721156, 'posterior_entropy': 2.584962500721156, 'actual_info_gain': 2.0, 'expected_info_gain': 4.178126483345813}
----------
The bot is making a guess...
THe possible candidates are: ['HEPAR', 'RECAP', 'REGAR', 'REMAP', 'REPAY', 'REWAX']
6 candidate words remaining.
Top 10 guesses: [('CAPER', '2.585'), ('COPER', '2.585'), ('MOPER', '2.585'), ('WHOMP', '2.585'), ('WHUMP', '2.585'), ('CRYER', '2.252'), ('PACER', '2.252'), ('PUCER', '2.252'), ('AMPLY', '2.252'), ('ASPER', '2.252')]
Top entropy choice: 洧쮫롖쩛롗洧洧똀 with entropy: 2.5850
Guess count high, choosing a candidate with the highest entropy: 洧똀洧洧쮫롖쩛롗 with entropy: 2.2516
You won! Amount of guesses: 4

===================================
History:
Guess: 洧똂洧떂洧똀洧洧똁, Feedback: 拘럻릳游릳游릳拘, Prior Entropy: 13.859, Expected Info Gain: 6.159 bits, Actual Info Gain: 6.458 bits, Posterior Entropy: 7.401, 
Guess: 洧떃洧洧떂洧똀洧, Feedback: 拘럻릴游릳游릳拘, Prior Entropy: 7.401, Expected Info Gain: 4.178 bits, Actual Info Gain: 2.816 bits, Posterior Entropy: 4.585, 
Guess: 洧뗴洧뗷洧뗼洧떂洧뗺, Feedback: 拘럭샢拘럻릴拘, Prior Entropy: 4.585, Expected Info Gain: 4.178 bits, Actual Info Gain: 2.000 bits, Posterior Entropy: 2.585, 
Guess: 洧똀洧洧쮫롖쩛롗, Feedback: 游릴游릴游릴游릴游릴
===================================

Testing bot class: NonGreedyCachedEntropyWordleBot complete.

----------------------------------------------------------------------------------------------------
